{
  "schemaVersion": "1.0.0",
  "updatedAt": "2026-07-24",
  "dataKind": "resin-property-groups",
  "sourceType": "curated-schema",
  "recordStatus": "reference",
  "data": {
    "General": [
      "密度",
      "熔体质量流动速率",
      "成型收缩率",
      "吸水率",
      "典型应用",
      "生产厂家",
      "牌号",
      "聚合工艺",
      "催化剂类型",
      "Density",
      "MFR",
      "Shrinkage",
      "Polymerization Process",
      "Catalyst Type"
    ],
    "Mechanical": [
      "拉伸屈服应力",
      "拉伸断裂应力",
      "拉伸模量",
      "断裂伸长率",
      "弯曲模量",
      "弯曲强度",
      "悬臂梁缺口冲击强度",
      "简支梁缺口冲击强度",
      "落镖冲击强度",
      "100%定伸应力",
      "拉伸强度",
      "压缩永久变形",
      "洛氏硬度",
      "邵氏硬度",
      "球压硬度",
      "摩擦系数",
      "耐磨性"
    ],
    "Thermal": [
      "热变形温度",
      "维卡软化温度",
      "熔点",
      "玻璃化转变温度",
      "线膨胀系数",
      "导热系数",
      "脆化温度",
      "氧化诱导时间(OIT)",
      "最高连续使用温度",
      "热稳定性"
    ],
    "Electrical": [
      "体积电阻率",
      "表面电阻率",
      "介电强度",
      "介电常数",
      "介质损耗角正切",
      "耐电弧性",
      "漏电起痕指数(CTI)"
    ],
    "Optical": [
      "透光率",
      "雾度",
      "光泽度",
      "黄色指数",
      "折射率"
    ],
    "Flammability": [
      "阻燃等级",
      "灼热丝发火温度(GWIT)",
      "极限氧指数(LOI)",
      "发烟量"
    ],
    "Chemical/Environmental": [
      "乙烯含量",
      "丁二烯含量",
      "丙烯腈含量",
      "结合苯乙烯",
      "门尼粘度",
      "灰分",
      "挥发分",
      "水分含量",
      "残余单体",
      "碳足迹",
      "再生料比例",
      "生物基含量"
    ],
    "Processing": [
      "建议烘料温度",
      "建议烘料时间",
      "注塑压力",
      "熔体温度",
      "模具温度",
      "保压压力",
      "冷却时间"
    ]
  }
}
