{
  "schemaVersion": "1.0.0",
  "dataKind": "resin-data-version",
  "sourceType": "repository-release",
  "recordStatus": "reference",
  "updatedAt": "2026-07-28",
  "data": {
    "release": "3.2.0",
    "dataSchema": "1.0.0",
    "authoritativePath": "data/resins",
    "runtimePath": "/data/resins",
    "compatibility": {
      "minimumAppVersion": "3.2.0"
    }
  }
}
